{
  "schema_version": "1.0.0",
  "feed_type": "index",
  "run_id": "wheel_drag_p2_01__seed20270303",
  "scenario_id": "wheel_drag_p2_01",
  "label": "Generated run: wheel_drag_p2_01 (seed 20270303, open loop)",
  "is_fixture": false,
  "t_s": 9899,
  "sim_time": "2027-03-01T02:44:59Z",
  "generated_at": "2026-10-21T02:48:53Z",
  "files": {
    "fleet_board": "fleet_board.json",
    "alerts": "alerts.json",
    "work_orders": "work_orders.json",
    "robots": {
      "P2-01": "robot_P2-01.json",
      "P2-02": "robot_P2-02.json",
      "P2-03": "robot_P2-03.json",
      "P2-04": "robot_P2-04.json",
      "P2-05": "robot_P2-05.json"
    }
  }
}
